{
  "schema_version": 1,
  "node_id": "chain-rule-basics",
  "overview": {
    "summary_for_learner": "Learn to differentiate composite functions using the chain rule: if y = f(g(x)), then dy/dx = f'(g(x)) · g'(x).",
    "outline": [
      "Identifying the outer and inner functions in a composite expression",
      "Applying the chain rule formula step by step",
      "Verifying results with worked examples"
    ],
    "assumed_children": ["basic-derivatives", "function-composition"]
  },
  "segments": [
    {
      "id": "identify-outer-inner",
      "intent": "Student can decompose a composite function into its outer and inner parts.",
      "question": "In $\\sin(x^2)$, which is the outer function and which is the inner?",
      "expected_paths": [
        {
          "label": "correct",
          "classifier_hint": "Student identifies sin as outer and x^2 as inner.",
          "response": "Exactly right. The outer function is f(u) = sin(u) and the inner is g(x) = x^2.",
          "is_misconception": false
        },
        {
          "label": "reversed",
          "classifier_hint": "Student says x^2 is outer and sin is inner.",
          "response": "Think about which operation is applied last. We compute x^2 first, then apply sin—so sin is the outer function.",
          "is_misconception": true
        },
        {
          "label": "unclear",
          "classifier_hint": "Student is confused or gives a partial or unrelated answer.",
          "response": "Evaluate at x = 2: first compute 2^2 = 4, then sin(4). The last operation applied is the outer one—here, sin.",
          "is_misconception": true
        }
      ],
      "hint_ladder": [
        {
          "level": "probe",
          "text": "If you evaluate sin(x^2) at x = 3, what do you compute first—squaring or taking the sine?"
        },
        {
          "level": "nudge",
          "text": "The function applied last to produce the output is called the outer function. Which operation—squaring or sine—is applied last?"
        },
        {
          "level": "near-answer",
          "text": "You compute x^2 first (that result is the inner), then apply sin to it (that is the outer). So sin is outer and x^2 is inner."
        },
        {
          "level": "tell",
          "text": "Outer: f(u) = sin(u). Inner: g(x) = x^2. The chain rule will use f'(g(x)) · g'(x) = cos(x^2) · 2x."
        }
      ],
      "resolution": "Correct identification of outer and inner is always the first step of the chain rule. Here f(u) = sin(u) and g(x) = x^2.",
      "quick_checks": [
        {
          "question": "In $e^{3x}$, what is the inner function?",
          "expected_answer": "3x"
        }
      ]
    },
    {
      "id": "apply-chain-rule",
      "intent": "Student applies the chain rule formula to compute the derivative of a composite function.",
      "question": "Using the chain rule, find $\\frac{d}{dx}\\sin(x^2)$.",
      "expected_paths": [
        {
          "label": "correct",
          "classifier_hint": "Student writes 2x·cos(x^2) or an equivalent form.",
          "response": "Correct! f'(u) = cos(u), g'(x) = 2x, so the derivative is cos(x^2) · 2x = 2x cos(x^2).",
          "is_misconception": false
        },
        {
          "label": "forgot-inner-derivative",
          "classifier_hint": "Student writes cos(x^2) without the factor of 2x.",
          "response": "You differentiated the outer function correctly, but you must multiply by the inner derivative g'(x) = 2x.",
          "is_misconception": true
        },
        {
          "label": "differentiated-inner-only",
          "classifier_hint": "Student writes 2x or cos(x) without combining both parts.",
          "response": "Remember: differentiate the outer first (keeping inner unchanged), then multiply by the inner's derivative.",
          "is_misconception": true
        }
      ],
      "hint_ladder": [
        {
          "level": "probe",
          "text": "What is f'(u) when f(u) = sin(u)?"
        },
        {
          "level": "nudge",
          "text": "You have f'(u) = cos(u). Now what is g'(x) when g(x) = x^2?"
        },
        {
          "level": "near-answer",
          "text": "f'(u) = cos(u) and g'(x) = 2x. The chain rule combines them: f'(g(x)) · g'(x) = cos(x^2) · 2x."
        },
        {
          "level": "tell",
          "text": "d/dx[sin(x^2)] = cos(x^2) · 2x = 2x cos(x^2). Outer derivative evaluated at the inner, multiplied by the inner derivative."
        }
      ],
      "resolution": "The chain rule gives d/dx[sin(x^2)] = cos(x^2) · 2x. Pattern: outer prime at inner, times inner prime.",
      "quick_checks": [
        {
          "question": "What is $\\frac{d}{dx}e^{3x}$?",
          "expected_answer": "3e^(3x)"
        }
      ]
    }
  ],
  "templates": [
    {
      "id": "chain-easy",
      "stem": "Find the derivative of $(x + 1)^2$.",
      "answer_expr": "2*(x + 1)",
      "marking_notes": "Accept 2(x+1) or the expanded form 2x+2. Both are equivalent.",
      "difficulty": "easy"
    },
    {
      "id": "chain-medium",
      "stem": "Find the derivative of $\\sin(2x)$.",
      "answer_expr": "2*cos(2*x)",
      "marking_notes": "Accept 2cos(2x). The coefficient of 2 from the inner derivative is required.",
      "difficulty": "medium"
    },
    {
      "id": "chain-hard",
      "stem": "Find the derivative of $e^{x^2}$.",
      "answer_expr": "2*x*exp(x**2)",
      "marking_notes": "Accept 2x·e^(x^2). The coefficient 2x from the inner derivative is required.",
      "difficulty": "hard"
    }
  ],
  "diagnostic": [
    {
      "id": "diag-01",
      "question": "In $\\cos(x^3)$, identify the inner function.",
      "expected_answer": "x^3",
      "outcome_refs": ["outcome-identify-composite"]
    },
    {
      "id": "diag-02",
      "question": "Compute $\\frac{d}{dx}(2x+1)^3$.",
      "expected_answer": "6(2x+1)^2",
      "outcome_refs": ["outcome-apply-chain-rule"]
    },
    {
      "id": "diag-03",
      "question": "Compute $\\frac{d}{dx}\\cos(x^2)$.",
      "expected_answer": "-2x sin(x^2)",
      "outcome_refs": ["outcome-apply-chain-rule"]
    },
    {
      "id": "diag-04",
      "question": "In $\\ln(x^2 + 1)$, what is the outer function?",
      "expected_answer": "ln(u)",
      "outcome_refs": ["outcome-identify-composite"]
    },
    {
      "id": "diag-05",
      "question": "Compute $\\frac{d}{dx}\\ln(x^2 + 1)$.",
      "expected_answer": "2x/(x^2+1)",
      "outcome_refs": ["outcome-apply-chain-rule"]
    },
    {
      "id": "diag-06",
      "question": "True or false: the chain rule is needed to differentiate $\\sin(x)$.",
      "expected_answer": "False",
      "outcome_refs": ["outcome-identify-composite"]
    },
    {
      "id": "diag-07",
      "question": "Compute $\\frac{d}{dx}\\sqrt{3x+2}$.",
      "expected_answer": "3/(2*sqrt(3x+2))",
      "outcome_refs": ["outcome-apply-chain-rule"]
    },
    {
      "id": "diag-08",
      "question": "What is $\\frac{d}{dx}\\tan(x^2)$?",
      "expected_answer": "2x sec^2(x^2)",
      "outcome_refs": ["outcome-apply-chain-rule"]
    },
    {
      "id": "diag-09",
      "question": "In $e^{\\sin(x)}$, what is the inner function?",
      "expected_answer": "sin(x)",
      "outcome_refs": ["outcome-identify-composite"]
    },
    {
      "id": "diag-10",
      "question": "Compute $\\frac{d}{dx}e^{\\sin(x)}$.",
      "expected_answer": "cos(x)*e^(sin(x))",
      "outcome_refs": ["outcome-apply-chain-rule"]
    }
  ],
  "summary_for_context": "The chain rule differentiates composite functions: d/dx[f(g(x))] = f'(g(x)) · g'(x). Step 1: identify outer f and inner g. Step 2: differentiate outer (keeping inner unchanged). Step 3: multiply by inner derivative. Example: d/dx[sin(x^2)] = cos(x^2) · 2x = 2x cos(x^2)."
}
